{
  "$schema": "https://json-schema.org/draft/2020-12/schema",
  "type": "array",
  "items": {
    "type": "object",
    "additionalProperties": false,
    "required": [
      "name",
      "title",
      "description",
      "category",
      "format",
      "path",
      "source",
      "schema"
    ],
    "properties": {
      "name": { "type": "string", "minLength": 1 },
      "title": { "type": "string", "minLength": 1 },
      "description": { "type": "string", "minLength": 1 },
      "category": { "type": "string", "minLength": 1 },
      "format": { "type": "string", "enum": ["json"] },
      "path": { "type": "string", "minLength": 1 },
      "source": { "type": "string", "minLength": 1 },
      "schema": { "type": "string", "minLength": 1 }
    }
  }
}
